<?xml version="1.0" encoding="UTF-8"?>
<!DOCTYPE armylist SYSTEM "gameSystem.dtd">
<!--
    Document   : FoW.xml

    Author     : pasi
    Description:
        Purpose of the document follows.
-->

<gameSystem>
 <gameSystemHeader id="header">
    <name complete="Flames of War" short="FoW">
    </name> 
    <points defaultTargetPointcost="1500"/>
 </gameSystemHeader>


<weaponProfiles>
 <weaponProfile name="Weapon">
   <weaponStatHeader name="Range"/>
   <weaponStatHeader name="ROF"/>
   <weaponStatHeader name="Anti-tank"/>
   <weaponStatHeader name="Firepower"/>
   <weaponStatHeader name="Notes"/>
 </weaponProfile> 
</weaponProfiles>
 
<modelStatGroups>


<modelStatGroup name="Infantry">
<modelStat symbol="Type" tooltip="Type" type="STRING">
</modelStat>
<modelStat symbol="Size" tooltip="Size" type="INTEGER">
</modelStat>
<modelStat symbol="Mot" tooltip="Motivation" type="STRING">
</modelStat>
<modelStat symbol="S" tooltip="Skill" type="STRING">
</modelStat>
</modelStatGroup>
  
<modelStatGroup name="Vehicle">
<modelStat symbol="M" tooltip="Mobility" type="STRING">
</modelStat>
<modelStat symbol="FA" tooltip="Front Armor" type="INTEGER">
</modelStat>
<modelStat symbol="SA" tooltip="Side Armor" type="INTEGER">
</modelStat>
<modelStat symbol="TA" tooltip="Top Armor" type="INTEGER">
</modelStat>
<modelStat symbol="Mot" tooltip="Motivation" type="STRING">
</modelStat>
<modelStat symbol="S" tooltip="Skill" type="STRING">
</modelStat>
</modelStatGroup>

<modelStatGroup name="Infantry with transport">
<modelStat symbol="Type" tooltip="Type" type="STRING">
</modelStat>
<modelStat symbol="Size" tooltip="Size" type="INTEGER">
</modelStat>
<modelStat symbol="M" tooltip="Mobility" type="STRING">
</modelStat>
<modelStat symbol="FA" tooltip="Front Armor" type="INTEGER">
</modelStat>
<modelStat symbol="SA" tooltip="Side Armor" type="INTEGER">
</modelStat>
<modelStat symbol="TA" tooltip="Top Armor" type="INTEGER">
</modelStat>
<modelStat symbol="Mot" tooltip="Motivation" type="STRING">
</modelStat>
<modelStat symbol="S" tooltip="Skill" type="STRING">
</modelStat>
</modelStatGroup>


<modelStatGroup name="Squad">
<modelStat symbol="#Bases" tooltip="Number of Bases" type="STRING">
</modelStat>
<modelStat symbol="Mot" tooltip="Motivation" type="STRING">
</modelStat>
<modelStat symbol="S" tooltip="Skill" type="STRING">
</modelStat>
</modelStatGroup>

<modelStatGroup name="Squad (2)">
<modelStat symbol="Team1" tooltip="Team 1" type="STRING"/>
<modelStat symbol="Team2" tooltip="Team 2" type="STRING"/>
<modelStat symbol="Mot" tooltip="Motivation" type="STRING">
</modelStat>
<modelStat symbol="S" tooltip="Skill" type="STRING">
</modelStat>
</modelStatGroup>

<modelStatGroup name="Squad (3)">
<modelStat symbol="Team1" tooltip="Team 1" type="STRING"/>
<modelStat symbol="Team2" tooltip="Team 2" type="STRING"/>
<modelStat symbol="Team3" tooltip="Team 3" type="STRING"/>
<modelStat symbol="Mot" tooltip="Motivation" type="STRING">
</modelStat>
<modelStat symbol="S" tooltip="Skill" type="STRING">
</modelStat>
</modelStatGroup>

<modelStatGroup name="Squad (4)">
<modelStat symbol="Team1" tooltip="Team 1" type="STRING"/>
<modelStat symbol="Team2" tooltip="Team 2" type="STRING"/>
<modelStat symbol="Team3" tooltip="Team 3" type="STRING"/>
<modelStat symbol="Team4" tooltip="Team 4" type="STRING"/>
<modelStat symbol="Mot" tooltip="Motivation" type="STRING">
</modelStat>
<modelStat symbol="S" tooltip="Skill" type="STRING">
</modelStat>
</modelStatGroup>

<modelStatGroup name="Squad (5)">
<modelStat symbol="Team1" tooltip="Team 1" type="STRING"/>
<modelStat symbol="Team2" tooltip="Team 2" type="STRING"/>
<modelStat symbol="Team3" tooltip="Team 3" type="STRING"/>
<modelStat symbol="Team4" tooltip="Team 4" type="STRING"/>
<modelStat symbol="Team5" tooltip="Team 5" type="STRING"/>
<modelStat symbol="Mot" tooltip="Motivation" type="STRING">
</modelStat>
<modelStat symbol="S" tooltip="Skill" type="STRING">
</modelStat>
</modelStatGroup>

</modelStatGroups>
 
<unitTypes>
 <unitType name="Headquaters Platoons" largePic="FoW/hq" smallPic="FoW/hq_16" postfix=".jpg"/>
 <unitType name="Combat Platoons" largePic="FoW/combat" smallPic="FoW/combat_16" postfix=".jpg"/>
 <unitType name="Weapons Platoons" largePic="FoW/weapons" smallPic="FoW/weapons_16" postfix=".jpg"/>
 <unitType name="Support Platoons" largePic="FoW/support" smallPic="FoW/support_16" postfix=".jpg"/>
 
</unitTypes>
 
</gameSystem>
